Utterance,ExpectedResult,BusinessArea,LuisQnA
"Where should a resource report if the current lock status is ""Premature Roll-off""",Premature roll off signifies release of an employee from the project; before the expected release date. You will be intimated by email ; in case of premature roll off. If your current lock status is Premature Roll off; you will continue to charge time to the same WBSe provided by the project until the date specified by Scheduling team or till they get HL intimation for next project.Incase you are rolled off from the project; you will receive another mail confirming roll off date to ITP; after that you can use ITP WBSe.,Staffing,QnA
What are the guidelines of roll off after 18 months of being in the project?,Ideally all employees’ completing 18 months in a project are eligible to request to roll off from the project. To initiate the process; you should speak with your Project Manager (PM) or DU Lead (DUL) and inform them . Basis the discussion and your career aspirations; your PM/DUL will share the the final decision and next steps.,Staffing,QnA
Where can I check my lock status? ,To check on your lock status log on to https://ast.accenture.com  > click on  My profile (Tab) >office details. ,Staffing,QnA
Where can I know my roll-off date?,You have to reach out to your Supervisor for roll-off date details.,Staffing,QnA
Where can the employee know about premature roll off? ,Premature roll off signifies release of an employee from the project; before the expected release date. You will be intimated by email ; in case of premature roll off. If your current lock status is Premature Roll off; you will continue to charge time to the same WBSe provided by the project until the date specified by Scheduling team or till they get HL intimation for next project.Incase you are rolled off from the project; you will receive another mail confirming roll off date to ITP; after that you can use ITP WBSe.,Staffing,QnA
What to do if my name is not reflecting in the Bench list.,In case your name does not appear on the ITP List then reach out to your ITP supervisor. Also; all employees who are unassigned are allocated to ITP DUs on a daily basis. Thus it is possible that you are unassigned (bench) but are still not part of ITP DU. Until you receive specific communication on your alignment to ITP DU; please use the ITP Unassigned WBSe.,Staffing,QnA
When will I receive intimation about movement to ITP post foundation training?,You will receive a mail one day before your last date in training; to confirm training roll off date. For your next assignment; you are required to refer to the hard lock mail; if you have received any.,Staffing,QnA
When will I be staffed on a project? ,The Scheduling team helps match open project opportunities to employees basis  the skill; level and location.You will receive an email confirmation from IDC Scheduling team when you are staffed on a project. Incase you need further information please contact your ITP DU lead.,Staffing,QnA
Where can I procure some software to exercise my technical skills while on ITP? ,To test your technical skills; you can procure software only from https://software.accenture.com.,Staffing,QnA
"While in ITP or Ag holding , is it necessary that I report to office every day? ",Yes; it is mandatory that you report to office every day whether you are staffed on a project or are on ITP. Unauthorized absence is a violation of Accenture policy. If you would like to avail leave due to any valid reason or personal situation; please seek approval from your supervisor in advance.,Staffing,QnA
Where will I be seated while I am aligned to ITP? ,You will receive an email notification from the Capacity Planning team on seating. As a part of AG holding; you will be seated in an ITP or AG holding bay in your location along with the other ITP members. This will enable you to participate actively in all the ITP initiatives. If you are assigned to a project; contact your supervisor for workstation details. If you are an ITP resource and still you don’t have your workstation details; please reach out to your ITP supervisor for workstation details. Alternatively you can write to <location specific>.capacityplanning@accenture.com. These details are also available on the below link https://india.acp.accenture.com > or Call Capacity Planning POC. ,Staffing,QnA
Who is my supervisor while on ITP? ,You will receive your ITP supervisor details via email.Your supervisor while on ITP will be from the ITP DU and will be assigned to you by the DU. Your supervisor will typically be from a similar technology background and you will be reporting to your ITP supervisor for the duration of your ITP tenure.,Staffing,QnA
"What is my DU, who is my DU lead and PA Support representative while in ITP or Ag holding? ",All IDC locations have ITP DUs to which ITP employees are assigned; while they are on ITP. You will be intimated about your DU; DU lead and your People Advisor via an email that will be sent to you; once you are aligned to the respective DU. ,Staffing,QnA
Show me list of internal  Jobs for Bengaluru,The list of job openings relevant to your Career Level; Skill Set ; Capability ; Speciality are given below:Are you interested in applying for any job opening from the list?,IJP,Luis
Show  me list of GCP Positions?,To view GCP opening  list; please logon to Accenture  CareeratMarketplace.,IJP,Luis
Show  me list of GCP openings?,To view GCP opening  list; please logon to Accenture  CareeratMarketplace.,IJP,Luis
Show me list of GCP openings for U.S.A?,To view GCP opening  list; please logon to Accenture  CareeratMarketplace.,IJP,Luis
How do I search for open positions for GCP roles?,To view GCP opening  list; please logon to Accenture  CareeratMarketplace.,IJP,Luis
"Yes , I would like to submit my application for  Role R12323123",Yes; I can do that for you .Please provide me the role id of the position for which you want to apply . For ex : Apply for role R121212Please help me with the mandatory information required before submission of your application1. Please confirm if your phone number is < 12343143432>.2. Please give a brief description of your current role. For eg- I am currently leading the project for X client which involves project management; handling multiple stakeholders; leading a team of 6.3. Please confirm if you have informed your supervisor before applying for the position. Yes/No.4. Please confirm if you have your latest resume updated on Myscheduling. Yes/No.For onshore role - ask additional flow questions..Please confirm if you have <country> valid visa? Please provide your Visa Number.Please provide your validation tenure.Please help me with the mandatory information required before submission of your applicationThank you; for the information.Your application has been submitted.Your application Id is <vbncbn>.,IJP,Luis
I want to apply for role id  xyzgh,Yes; I can do that for you .Please provide me the role id of the position for which you want to apply . For ex : Apply for role R121212Please help me with the mandatory information required before submission of your application1. Please confirm if your phone number is < 12343143432>.2. Please give a brief description of your current role. For eg- I am currently leading the project for X client which involves project management; handling multiple stakeholders; leading a team of 6.3. Please confirm if you have informed your supervisor before applying for the position. Yes/No.4. Please confirm if you have your latest resume updated on Myscheduling. Yes/No.For onshore role - ask additional flow questions..Please confirm if you have <country> valid visa? Please provide your Visa Number.Please provide your validation tenure.Please help me with the mandatory information required before submission of your applicationThank you; for the information.Your application has been submitted.Your application Id is <vbncbn>.,IJP,Luis
What is status of my applications? ,The status of all your active applications are-,IJP,Luis
please share my application status for role id Rxyxcbh,The status of all your active applications are-,IJP,Luis
"No , I would not like to submit any application.",Sure; How else can I assist you? To check for more open position options;  you can log on to IJP .,IJP,Luis
no I am not interested,Sure; How else can I assist you? To check for more open position options;  you can log on to IJP .,IJP,Luis
Can I apply for the Offshore roles on the career marketplace?,You can apply for Offshore roles through the IJP Portal.  In case you wish to apply for Onshore(GCP) roles & CECP roles; you can do so through Career Marketplace. I can help you with the list of Offshore job opportunities; if you would like.,IJP,QnA
"If an employee has any queries around IJP, who do they reach out to?",If you have any queries around IJP write to myijp.queries@accenture.com,IJP,QnA
Are TFSs marked in the auto mailers that are sent to applicants intimating them on the status of their application?,The auto-generated email confirming the status of an employee’s application is marked only to the employee and the DU Lead.,IJP,QnA
What is the next step post an applicant getting selected for a role and release date being finalized?,If your selection is confirmed for a particular role you will be notified via email from the IJP tool. The project will lock you against the applied opportunity. You can view your application status under “Application Status” by logging on to IJP Home Page. ,IJP,QnA
what happens after selection?,If your selection is confirmed for a particular role you will be notified via email from the IJP tool. The project will lock you against the applied opportunity. You can view your application status under “Application Status” by logging on to IJP Home Page. ,IJP,QnA
Is there a system enabled check to determine if a rejected resource has reapplied for the same role?,It is not recommended to reapply for the same role that you have been rejected for. In case you do so your application would be rejected again.,IJP,QnA
How is IJP tool is ensuring that a rejected candidate is not reapplying for the same position again?,It is not recommended to reapply for the same role that you have been rejected for. In case you do so your application would be rejected again.,IJP,QnA
Does the tool restrict an employee from applying to 2 demands for the same project with similar SLL combination?,The system does not check for this when receiving an application from employees,IJP,QnA
"If an applicant has an FHL against him/her in DSM, would the FHL Project be intimated of the employee’s application to the IJP Demand?",Currently the IJP intimation only goes to the employee and the employee’s current DUL. If the applicant gets selected for a role through IJP; the expectation from the TFS would be to seek consensus on the resource’s release from the FHL Project .,IJP,QnA
how is role and talent segment used n Accenture?,Talents segments help define what you do. Talent segments group together people with similar skills and types of work and help you better identify open staffing or transition opportunities and mentors. All roles in Accenture are aligned to a talent segment; Examples include: Software Engineering; Business and Systems Integration; etc. It's useful to think of talent segments as a series of modular building blocks.,CareerDevelopment,QnA
What does talent segment mean to me ,Talents segments help define what you do. Talent segments group together people with similar skills and types of work and help you better identify open staffing or transition opportunities and mentors. All roles in Accenture are aligned to a talent segment; Examples include: Software Engineering; Business and Systems Integration; etc. It's useful to think of talent segments as a series of modular building blocks.,CareerDevelopment,QnA
How is the talent segment assigned ,Talents segments help define what you do. Talent segments group together people with similar skills and types of work and help you better identify open staffing or transition opportunities and mentors. All roles in Accenture are aligned to a talent segment; Examples include: Software Engineering; Business and Systems Integration; etc. It's useful to think of talent segments as a series of modular building blocks.,CareerDevelopment,QnA
What does Role mean to me ,Every talent segment has multiple roles associated with it. Roles provide you with greater specificity about the responsibilities and skills you need to excel and grow. Roles for examples are: business process delivery analyst; database administrator associate manager; application architect senior manager and project and service management manager etc. All role names are a combination of the function you perform and your career level designation (e.g.; manager; analyst). Your role is a key factor in how you determine your skill development needs; identify career progression options and plot your next career move. Assigned roles define the particular set of activities that you will perform on a specific project assignment. Your assigned roles are tracked on your internal CV as you move from project to project and/or client to client. Assigned roles help your next potential client team understand the work you have done.,CareerDevelopment,QnA
How is the role`s assigned to an employee,Every talent segment has multiple roles associated with it. Roles provide you with greater specificity about the responsibilities and skills you need to excel and grow. Roles for examples are: business process delivery analyst; database administrator associate manager; application architect senior manager and project and service management manager etc. All role names are a combination of the function you perform and your career level designation (e.g.; manager; analyst). Your role is a key factor in how you determine your skill development needs; identify career progression options and plot your next career move. Assigned roles define the particular set of activities that you will perform on a specific project assignment. Your assigned roles are tracked on your internal CV as you move from project to project and/or client to client. Assigned roles help your next potential client team understand the work you have done.,CareerDevelopment,QnA
what support do I get basis the role assigned ,Every talent segment has multiple roles associated with it. Roles provide you with greater specificity about the responsibilities and skills you need to excel and grow. Roles for examples are: business process delivery analyst; database administrator associate manager; application architect senior manager and project and service management manager etc. All role names are a combination of the function you perform and your career level designation (e.g.; manager; analyst). Your role is a key factor in how you determine your skill development needs; identify career progression options and plot your next career move. Assigned roles define the particular set of activities that you will perform on a specific project assignment. Your assigned roles are tracked on your internal CV as you move from project to project and/or client to client. Assigned roles help your next potential client team understand the work you have done.,CareerDevelopment,QnA
How can I share my career experience with Accenture ,At Accenture; we encourage and value feedback from our people and the Leadership is always keen to listen to your thoughts; ideas and suggestions. You can share your feedback through various channels with your project or industry group leadership like town halls; skip level discussions; meaningful conversations and by responding to the team engagement surveys etc. ,CareerDevelopment,QnA
what methods are followed to receive feedback from employees,At Accenture; we encourage and value feedback from our people and the Leadership is always keen to listen to your thoughts; ideas and suggestions. You can share your feedback through various channels with your project or industry group leadership like town halls; skip level discussions; meaningful conversations and by responding to the team engagement surveys etc. ,CareerDevelopment,QnA
what is the mechanism for sharing feedback with leadership,At Accenture; we encourage and value feedback from our people and the Leadership is always keen to listen to your thoughts; ideas and suggestions. You can share your feedback through various channels with your project or industry group leadership like town halls; skip level discussions; meaningful conversations and by responding to the team engagement surveys etc. ,CareerDevelopment,QnA
How can I develop my skill,Accenture provides you multiple opportunities to build your expertise. Some of the key ways to do this are -1. Identify opportunities for growth and focus on skill development in that area. You can have a meaningful conversation with your supervisor and career counselor and supervisor to share your aspirations and seek their support on taking the next steps.2. Opt for formal trainings and chart your learning plan that will help you with skill building and for practical experience use your learnings on your job assignments.3. Make sure you document your Career Development as priority on Performance Achievement tool.,CareerDevelopment,QnA
how can I make myself an expert,Accenture provides you multiple opportunities to build your expertise. Some of the key ways to do this are -1. Identify opportunities for growth and focus on skill development in that area. You can have a meaningful conversation with your supervisor and career counselor and supervisor to share your aspirations and seek their support on taking the next steps.2. Opt for formal trainings and chart your learning plan that will help you with skill building and for practical experience use your learnings on your job assignments.3. Make sure you document your Career Development as priority on Performance Achievement tool.,CareerDevelopment,QnA
does the organization invest on employee career,Accenture provides you multiple opportunities to build your expertise. Some of the key ways to do this are -1. Identify opportunities for growth and focus on skill development in that area. You can have a meaningful conversation with your supervisor and career counselor and supervisor to share your aspirations and seek their support on taking the next steps.2. Opt for formal trainings and chart your learning plan that will help you with skill building and for practical experience use your learnings on your job assignments.3. Make sure you document your Career Development as priority on Performance Achievement tool.,CareerDevelopment,QnA
Who can help  with the Months at Level details ,The Month at Level data for an employee is also available at Mylearnings. Log on to mylearning.accenture.com go to my profile and you can check your months at level.In case of discrepancy in MAL data please reach out to your People Advisor.,CareerDevelopment,QnA
how can I find my Months at Level detail ,The Month at Level data for an employee is also available at Mylearnings. Log on to mylearning.accenture.com go to my profile and you can check your months at level.In case of discrepancy in MAL data please reach out to your People Advisor.,CareerDevelopment,QnA
I need to know my Moths at Level detail,The Month at Level data for an employee is also available at Mylearnings. Log on to mylearning.accenture.com go to my profile and you can check your months at level.In case of discrepancy in MAL data please reach out to your People Advisor.,CareerDevelopment,QnA
How will I know if my Probation Period is confirmed? ,The organization does not issue a probation confirmation mail or letter at the end of the probation period. Unless otherwise communicated by your Supervisor/HR Representative; your employment is considered to be confirmed post completion of 6 months.,CareerDevelopment,QnA
when will I know that my probation has been confirmed?,The organization does not issue a probation confirmation mail or letter at the end of the probation period. Unless otherwise communicated by your Supervisor/HR Representative; your employment is considered to be confirmed post completion of 6 months.,CareerDevelopment,QnA
how will I know that my probation has been confirmed?,The organization does not issue a probation confirmation mail or letter at the end of the probation period. Unless otherwise communicated by your Supervisor/HR Representative; your employment is considered to be confirmed post completion of 6 months.,CareerDevelopment,QnA
will there be any letter or message sent to me if probation has been confirmed?,The organization does not issue a probation confirmation mail or letter at the end of the probation period. Unless otherwise communicated by your Supervisor/HR Representative; your employment is considered to be confirmed post completion of 6 months.,CareerDevelopment,QnA
should I need to reach out to supervisor or HR rep to know what is the status on my probation?,The organization does not issue a probation confirmation mail or letter at the end of the probation period. Unless otherwise communicated by your Supervisor/HR Representative; your employment is considered to be confirmed post completion of 6 months.,CareerDevelopment,QnA
What is the timeline to re-activate a candidate profile?,A candidate can re-apply after 6months; from the date of the last interview.,Referral,QnA
when will I receive my RB?,The ER bonus will be paid out subject to the employee being active and onboard in Accenture on the date of disbursement of this payout. ,Referral,QnA
can referral resignation leads to returning RB?,Employee Referral awards granted will not be recovered if the referred candidate leaves the company.,Referral,QnA
What is the procedure to track my referral? ,You can track your referrals on https://employeereferrals.accenture.com. If your referral is hired; you will receive a confirmation e-mail that will include details regarding your referral incentive; if applicable.,Referral,QnA
when should I expected referral bonus payment,The referral bonus is paid along with the salary; in the subsequent month of the referred candidate's joining.,Referral,QnA
What do you need to do if status of the candidate is unavailable?. ,This could occur because of any one of the reasons mentioned below : 1.The details of recently referred candidate reflect on the global ER application after 24 hours. 2.If there is a change in the Enterprise Id by the referrer; then his/her referrals’ details will not be shown on the application screen.Apart from these if you are still facing any issues; please raise a request on https://myrequests.accenture.com,Referral,QnA
What are the guidelines for hiring candidates who are part time graduates?,We do hire candidates with part time graduation qualification; provided the candidate has at least 15 years of experience.,Referral,QnA
Referral portal page not opening ,In case you are facing this error; please log in using Internet explorer 5.0 & above and refresh the page. If the issue still persists; write to idc.talentscout@accenture.com,Referral,QnA
Where can I get answers to my Employee referral program queries?,You can contact Talent Scout helpdesk by raising a request on https://myrequests.accenture.com. To raise a request; follow these steps:a. Log in to https://myrequests.accenture.com.b. Under ‘Create Request’; click on ‘Ask HR a Question?’.c. Under ‘Category’; choose Recruitment Inquiry.d. Under ‘Subcategory’; choose the category applicable.e. Fill in the details of your request and click ‘submit’.The SLA to get a response from Talent Scout helpdesk is 3 working days.OrYou can join the TalentScout meeting via Skype; the call is scheduled daily from 12:00 noon to 1:00 p.m. For dial-in details refer to the weekly mailer from idc.talentscout@accenture.com .,Referral,QnA
What is the procedure to refer ex-employees of Accenture?,o refer an ex-employee; you have to upload the resume to https://employeereferralprogram.accenture.com/#/index. The referral process is same for all candidates.,Referral,QnA
What is the process to refer a candidate from his/her previous organization if he/she has signed any agreement?,Employees may not refer candidates from a previous employer if doing so would violate a non-solicitation/non-compete agreement.If it is a service agreement that a candidate has with his / her current organization; then you can refer the candidate; however; the candidate will need to comply and complete all required formalities in case they leave before the specific time period as per the agreement and before formally joining Accenture. ,Referral,QnA
"What is the general timeline employee referral process cycle take (from referral to hire, where applicable)?",The processing time for a referral can be impacted by multiple things and varies from country to country. However; on an average; the process can take about 6-8 weeks.,Referral,QnA
What do you need to do if you are not sure about the skill during upload?,If you are not sure about referring candidate's skills you can send their profile to idc.talentscout@accenture.com.,Referral,QnA
how to search for open roles for referring,"1.The search engine on https://employeereferrals.accenture.com works exactly like Google. You can search for open demands across the globe by entering - [group title] [location] [level] in the search area. For example; search like: “SAP Consultant Spain” or ""Japan Oracle"". You can  also sort the search column by relevance and add/ remove keywords to your search to get a different set of results. or2.You can get details of open position by reading the weekly mail communication from TalentScout IDC on your accenture mail account.",Referral,QnA
