Utterance,ExpectedResult,BusinessArea,LuisQnA
Is 14 November an optional holiday,<HolidayType> holiday for <Holiday> on <date in day of week; dd-mmm-yyyy format> in <Location>,Holiday,Luis
How many holidays are there this month,There are <number> <HolidayType> holidays this <time period> in <Location>.,Holiday,Luis
Which month has maximum number of holidays,<time period> has maximum number (<number>) of <HolidayType> holidays in <Location>.,Holiday,Luis
Which week has maximum number of holidays,<time period> has maximum number (<number>) of <HolidayType> holidays in <Location>.,Holiday,Luis
How many holidays are there in the coming month,There are <number> <HolidayType> holidays this <time period> in <Location>.,Holiday,Luis
How many public holidays do Accenture have,There are <number> <HolidayType> holidays this <time period> in <Location>.,Holiday,Luis
How many working days are there in September,There are <number> working days this <time period> in <Location>.,Holiday,Luis
Do we really have holiday tomorrow?,<HolidayType> holiday for <Holiday> on <date in day of week; dd-mmm-yyyy format> in <Location>,Holiday,Luis
I want to know whether tomorrow is a holiday or not?,<HolidayType> holiday for <Holiday> on <date in day of week; dd-mmm-yyyy format> in <Location>,Holiday,Luis
Do Accenture have holiday tomorrow?,<HolidayType> holiday for <Holiday> on <date in day of week; dd-mmm-yyyy format> in <Location>,Holiday,Luis
Do we have to come to office tomorrow?,<HolidayType> holiday for <Holiday> on <date in day of week; dd-mmm-yyyy format> in <Location>,Holiday,Luis
May I know if we have holiday tomorrow?,<HolidayType> holiday for <Holiday> on <date in day of week; dd-mmm-yyyy format> in <Location>,Holiday,Luis
Is it true that we have holiday tomorrow?,<HolidayType> holiday for <Holiday> on <date in day of week; dd-mmm-yyyy format> in <Location>,Holiday,Luis
Tomorrow holiday,<HolidayType> holiday for <Holiday> on <date in day of week; dd-mmm-yyyy format> in <Location>,Holiday,Luis
When is the next mandatory holiday?,<HolidayType> holiday for <Holiday> on <date in day of week; dd-mmm-yyyy format> in <Location>,Holiday,Luis
When is the next optional holiday?,<HolidayType> holiday for <Holiday> on <date in day of week; dd-mmm-yyyy format> in <Location>,Holiday,Luis
Do we have any long weekend during the month of December?,Next long weekend is:[<HolidayType> holiday for <Holiday> on <date in day of week; dd-mmm-yyyy format> in <Location>],Holiday,Luis
How many long weekends are there this year?,Next long weekend is:[<HolidayType> holiday for <Holiday> on <date in day of week; dd-mmm-yyyy format> in <Location>],Holiday,Luis
How many long weekends are there in this month?,Next long weekend is:[<HolidayType> holiday for <Holiday> on <date in day of week; dd-mmm-yyyy format> in <Location>],Holiday,Luis
Policy on Company Holidays in Accenture,Employees are entitled to 10 public holidays in a calendar year that comprise of 8 fixed holidays and 2 floating holidays. Here are some key points that you should be aware of - 1. Public holidays cannot be accumulated and carried forward to the next calendar year. 2. Public holidays are not encashable upon separation. 3. The 10 public holidays availed by the employee should be charged to Public Holiday/ Optional Holiday in MyTE. You can also refer to Policy 0033 - Holidays for more details.,Holiday,Luis
What is Applauding Empaneled Interviewers Program ,Applauding Empaneled Interviewers Program (AEIP) is a reward and recognition program for all Empaneled Interviewers from Delivery Centers for Technology in India who provide bandwidth for interviewing candidates for available opportunities. This program will reward all the empaneled interviewers with Vouchers/ Recognizing performance points for meeting minimum eligibility criteria for interviews conducted each quarter. The AEIP rewards are calculated on quarterly basis; and one quarter's interview bandwidth contribution does not get carried forward. Interviews like skills interview; final interview; executive interview; HireVue interview fall under the purview of the program.Top 5 Hirevue interviewers for the quarter INR 5000/ per EI >= 70 interviews conducted INR 12000/- >=35 interviews conducted INR 8000/- >=25 interviews conducted INR 5000/-Weekend walk-in (> 5 interviews) INR 1000/-Campus VSP INR 1250/dayNote- Each instance of Interviewer Renege / Feedback Pending will lead to deduction equivalent to 1 count of Interview conducted,Recruitment,QnA
Where can I view my contribution for the year? The tool is not showing correct count.,The Monthly AEIP contribution is uploaded on AEIP page on IDC Home portal. Kindly visit the same to view your interview count for the month.,Recruitment,QnA
What is the time period for AEIP RnR disbursement?,E-Gift Vouchers for any quarter will be disbursed in the next quarter. Eg. Gift Vouchers for Q1 ( Sep- Nov) will be disbursed in Q2 (Dec-Feb)and so on.The rewards are given in form of online e-vouchers from the current approved supplier. These are uploaded on Allsectech Utilities-Gift Vouchers and as per law; will be subject to taxation. The AEIP rewards are calculated on quarterly basis; hence one quarter's interview bandwidth contribution does not get carried forward.,Recruitment,QnA
What is the Helpdesk mail id for BMS queries?,BMS is the Bandwidth management system; a tool that helps schedule all interviews for Interviewers. You can access BMS with this link - https://recruitment-idc.accenture.com.Incase you are facing issues while accessing BMS tool write to EI.Helpdeskqueries@accenture.com with details of the issue.,Recruitment,QnA
Whom should you reach out you if there is a internship request with Accenture. ,For campus tie ups and internship you can write to campus.queries@accenture.com .The campus team will get back to the you with further details.,Recruitment,QnA
What is the guideline for Accenture to hire employees who are physically challenged?,Accenture offers Equal Employment Opportunity to everyone. The selection criterion for an opportunity is based on the qualification and job experience required to perform the role.,Recruitment,QnA
"What specific skills is Accenture looking for? Are roles limited to specific workforces, geographies or skill sets? ",Accenture is always looking for for best-in-class talent. We’re hiring across all growth platforms; operating groups; workforces for a variety of skills and geographies. To learn more about roles that are presently open and are of interest to you; please log on to - <referral link > ,Recruitment,QnA
What is the process to claim Relocation expenses?,All outstation candidates can avail company provided transit accommodation and relocation reimbursement as per eligibility criteria. You can check with recruiter on the relocation reimbursement amount that you are eligible to claim at your career level. Relocation assistance expenses can be provided for travel expenses for employee/dependents by air/train; movement of goods and household articles. All the expenses would have to be supported by relevant and original documents; invoices or bills and claimed at all at one time only within 3 months from date of transfer via the myTE tool. Please do take an attestation on these bills from your location People Advisor before submitting them,Recruitment,QnA
what all expenses can I claim under relocation expense?,All outstation candidates can avail company provided transit accommodation and relocation reimbursement as per eligibility criteria. You can check with recruiter on the relocation reimbursement amount that you are eligible to claim at your career level. Relocation assistance expenses can be provided for travel expenses for employee/dependents by air/train; movement of goods and household articles. All the expenses would have to be supported by relevant and original documents; invoices or bills and claimed at all at one time only within 3 months from date of transfer via the myTE tool. Please do take an attestation on these bills from your location People Advisor before submitting them,Recruitment,QnA
What is the process to get company provided accommodation?,Transit accommodation is provided by the company for a period of up to 14 calendar days; starting one day prior to the date of joining; at its designated Service apartments/ Guest houses. This will be given only for outstation candidates (where the joining and current location are different). If the accommodation is for a new joiner; the Onboarding POC will book the accommodation a week prior to joining date and share the address/Date/check-in time with the new joiner. Please note this will be a sharing accommodation; and it will be booked effective a day prior the joining date. Family accommodation is available for level 9 and above.,Recruitment,QnA
who are eligible for family accommodation?,Transit accommodation is provided by the company for a period of up to 14 calendar days; starting one day prior to the date of joining; at its designated Service apartments/ Guest houses. This will be given only for outstation candidates (where the joining and current location are different). If the accommodation is for a new joiner; the Onboarding POC will book the accommodation a week prior to joining date and share the address/Date/check-in time with the new joiner. Please note this will be a sharing accommodation; and it will be booked effective a day prior the joining date. Family accommodation is available for level 9 and above.,Recruitment,QnA
my friend is joining next week will he get transit family accommodation from Accenture?,Transit accommodation is provided by the company for a period of up to 14 calendar days; starting one day prior to the date of joining; at its designated Service apartments/ Guest houses. This will be given only for outstation candidates (where the joining and current location are different). If the accommodation is for a new joiner; the Onboarding POC will book the accommodation a week prior to joining date and share the address/Date/check-in time with the new joiner. Please note this will be a sharing accommodation; and it will be booked effective a day prior the joining date. Family accommodation is available for level 9 and above.,Recruitment,QnA
for how many days outstation employees get accommodation from company?,Transit accommodation is provided by the company for a period of up to 14 calendar days; starting one day prior to the date of joining; at its designated Service apartments/ Guest houses. This will be given only for outstation candidates (where the joining and current location are different). If the accommodation is for a new joiner; the Onboarding POC will book the accommodation a week prior to joining date and share the address/Date/check-in time with the new joiner. Please note this will be a sharing accommodation; and it will be booked effective a day prior the joining date. Family accommodation is available for level 9 and above.,Recruitment,QnA
What is the process for employees to be empaneled to conduct interviews?,To become empaneled to take interviews for Accenture; you can write to ruchita.shrivastav@accenture.com. All requests for empanelment are evaluated basis eligibility and approval. The list is refreshed each month and inactive interviewer are removed from list annually.,Recruitment,QnA
I want to be an empaneled interviewer?,To become empaneled to take interviews for Accenture; you can write to ruchita.shrivastav@accenture.com. All requests for empanelment are evaluated basis eligibility and approval. The list is refreshed each month and inactive interviewer are removed from list annually.,Recruitment,QnA
whom to contact in case I want to be interviewer for an event?,To become empaneled to take interviews for Accenture; you can write to ruchita.shrivastav@accenture.com. All requests for empanelment are evaluated basis eligibility and approval. The list is refreshed each month and inactive interviewer are removed from list annually.,Recruitment,QnA
how frequently the empaneled interviewer list is refreshed?,To become empaneled to take interviews for Accenture; you can write to ruchita.shrivastav@accenture.com. All requests for empanelment are evaluated basis eligibility and approval. The list is refreshed each month and inactive interviewer are removed from list annually.,Recruitment,QnA
What is CBI (Competency Based Interviewing) training? ,The Competency Based Interviewing training course is a mandatory requirement for an employee to become an Empaneled Interviewer. For CBI training related queries and WBSe details; write to  EI.Helpdeskqueries@accenture.com. You will need to ensure that this training is successfully completed before nominating yourself for any recruitment events or your time for taking interviews.,Recruitment,QnA
what is mandatory training that an interviewer has to complete?,The Competency Based Interviewing training course is a mandatory requirement for an employee to become an Empaneled Interviewer. For CBI training related queries and WBSe details; write to  EI.Helpdeskqueries@accenture.com. You will need to ensure that this training is successfully completed before nominating yourself for any recruitment events or your time for taking interviews.,Recruitment,QnA
mandatory training for empaneled interviewer,The Competency Based Interviewing training course is a mandatory requirement for an employee to become an Empaneled Interviewer. For CBI training related queries and WBSe details; write to  EI.Helpdeskqueries@accenture.com. You will need to ensure that this training is successfully completed before nominating yourself for any recruitment events or your time for taking interviews.,Recruitment,QnA
who provides wbse for CBI training,The Competency Based Interviewing training course is a mandatory requirement for an employee to become an Empaneled Interviewer. For CBI training related queries and WBSe details; write to  EI.Helpdeskqueries@accenture.com. You will need to ensure that this training is successfully completed before nominating yourself for any recruitment events or your time for taking interviews.,Recruitment,QnA
what is status of my exit ticket?,Hi <FullName> I can share the current status of your exit ticket Role and Status.,Exit,Luis
how many days are left to my LWD?,Hi <FullName>; I can share the details. <LWD Days> days are remaining to your LWD.,Exit,Luis
I resigned on 31st May 2017 and my probation confirmation date is 2nd June? Why I have to serve 90 days notice period?,Incase of discrepancy related to Notice period please contact your AEE case  manager and he/she will guide you further on the process.,Exit,Luis
how long is my Notice period?,Hi <FullName>; I can share the details. I see that on <current date> you have completed <Months in Accenture> months in accenture.You have to serve notice period of <Notice Period Days> days.,Exit,Luis
how long will be Notice period for an employee on active PIP?,Please reachout to your Supervisor <SupervisorFullName> to get confirmation on your notice period tenure and LWD.For further assistance you can contact your people advisor <PeopleAdvisorFullName>.,Exit,Luis
by how many days can I backdate my resignation on AST?,I am sorry to hear that you have decided to leave Accenture. The tool will allow you to backdate your exit date only upto 7 calendar days from today. I hope you have explored all avenues within Accenture and have had a discussion with your supervisor & people advisor. Do ensure you speak to your supervisor after raising your exit on tool. I can provide you the details.Can you please share the date on which you have formally resigned from Accenture.Are your contact details updated on AST?You can backdate your exit  maximum by <mm/dd/yyyy>.,Exit,Luis
what is status of my exit checklist?,Hi <FullName>; I can share the current status of your exit checklist.Stakeholder Checklist StatusSupervisor Checklist ClosedWorkplace OpenFinance Open There is no action required from you on the exit checklist. The respective teams will close the checklists as per their SLA. In case they need any further inputs; they will reach out to you.,Exit,Luis
when is my approved lwd?,Hi <FullName>; I can share the details. You LWD in Accenture is <LWD Date>.,Exit,Luis
I resigned before my probation confirmation date? Why I have to serve 90 days notice period?,Incase of discrepancy related to Notice period please contact your AEE case  manager and he/she will guide you further on the process.,Exit,Luis
I have not received any mailer confirming my probation. Why I have to serve 90 days notice period?,Incase of discrepancy related to Notice period please contact your AEE case  manager and he/she will guide you further on the process.,Exit,QnA
Why is the tool not letting me select today or tomorrow as the LWD?,For on time FnF settlement of an employee; its mandatory to have atleast 12 working days’ between date of raising the exit on AST tool and LWD.,Exit,QnA
How can I raise resignation on AST?,You need to follow the steps given below to raise your exit on AST. Step 1: Log on to https://ast.accenture.com/atlas. On the tool click on New Request-->Exit Request. Step 2: On the instruction page; please select Yes for the details that you want to be update and No for details that are already updated. If you update any Personal details (Primary Contact Number; Alternate Mailing Address or External Email ID) It would take 2-3 working days for the details to reflect on the AST tool. In case any of the mandatory field are blank earlier; you are required to update the same and wait for (2-3 working days) the same to get updated on the tool.Step 3: Once those fields are updated; please click on 'continue' button. Provide the details regarding your Resignation Date; Last Working Date and Comments on the next page then click on Submit. Few important things for consideration are : 1.The tool will restrict you to select the Resignation date which falls within 7 working days from the date of raising the request on the tool. 2.Once you click on submit button; it will take you to employees Responsibilities and Rights page which you will need to accept post which your exit request will be sent across to your Supervisor and then to the AEE Case Manager for approvals. 3.Upon supervisor’s approval on tool; the exit checklist will open for various departments 12 days prior to your LWD. These departments will reach back to you if there is any action required from your end. They will approve the checklist on the tool. 4.You can check the status of the checklists by logging into the tool.5. A snapshot of the exit checklist closure status will also be sent to you on or before 7 days from LWD.Do ensure that you speak to your supervisor after raising your exit on tool.,Exit,QnA
Is the Joining Bonus recovery from an Exiting employee inclusive or Exclusive of Notice period(if locking period is 1 year as per the Offer letter).,The Joining Bonus lock in period is inclusive of the notice period. You don’t have to payback your Joining bonus to Accenture if the last working day is beyond the lock in period mentioned in your Joining Bonus letter.,Exit,QnA
I want to change my Last Working Day. How do I do that?,Supervisors’ have the access on AST to change the LWD till 12 working days prior to LWD. Supervisor has to ensure that the new LWD date cannot be less than 12 days from the current date. The change in LWD will mean that the ticket will open again for  other stakeholder's approval (wherever applicable). In case the LWD change request is within the timeline and still the change is not reflecting on tool; please get in touch with the AEE case Manager for getting the changes done from backend.,Exit,QnA
How am I suppose to raise the Exit on AST when the continue button is greyed out for me?,The continue button is greyed out  for you on the tool; since you have raised a request on MyRequest tool to update your personal details. The personal details will get updated on the AST tool in 2-3 business days; post which you can raise the exit request on the AST tool. You may backdate your resignation date up to 7 calendar days.,Exit,QnA
Can my leaves be adjusted against my NP?,Your leaves cannot be adjusted against your notice period. Your excess vacation leave will be encashed in your F&F settlement. Vacation encashment will be calculated on basic salary only and will be subject to prevailing tax laws. Sick Leave balance and Public holidays are not enchashable upon separation. Notice period recoveries are treated separately in the F&F Settlement.,Exit,QnA
To which address will be letters will be sent & When?,Resignation acceptance e-mail will be sent to your Accenture mail id & personal mail id by India.AEE.HR@accenture.com 10 days prior to your last working day provided the AEE Case Manager and the Supervisor have approved the Exit ticket on the tool within stipulated SLA. You will receive the relieving letter 21 working days after your LWD after all the checklists are closed and the F&F is cleared by the Finance team.  You will receive the Relieving Letter soft copy in your personal mail ID and hard copy will be sent to alternate mailing address as per the AST records. Should you need further assistance on the same drop a mail to India.HRSSC.Exits@accenture.,Exit,QnA
How can I submit my Time Report if the LWD falls in between the fortnight?,You are required to create a work schedule activity on the MyTE tool to submit your TR. Log on to https://myte.accenture.com . Look for a work schedule option at bottom left side of the page; select Work Schedule as full time 9hrs; choose custom work schedule for this period only and then click on create. Fill the time for the respective days and leave it blank for the remaining days; check your calculated work hours; save and submit.,Exit,QnA
I am not able to raise my exit on AST as the screen is blacked out for me,You can check the application in 6.0 IE or try to login from some other machine. Once you login to AST scroll down on the same page; select “NO” for the entire drop down list and click on continue to raise a request. Click on “Update Now” to update the fields for which you are not able to select “NO”. If the issues still persist; you can share the screen shot of the page with India.ASTHelpDesk team.,Exit,QnA
How can I buy out my notice period?,You are required to serve the complete notice period as per your terms of employment. If you have exceptional circumstances requiring an earlier exit; the AEE Case manager will guide you further on your request.,Exit,QnA
What is myScheduling,myScheduling is the main website for all of Accenture's scheduling tools. It provides links to 1. myScheduling Supply and Demand details 2. myScheduling Reporting and 3. myCV/Resume tool (to create; edit; and download resumes).,Staffing,QnA
Where can I access the myScheduling Tool?,To access myScheduling log on to https://myscheduling.accenture.com/.,Staffing,QnA
What details can an employee view in myScheduling?,Myscheduling shows details of your project experience and skills. This information is often referred and presented to project leads and clients while finding you a suitable opportunity. Don't forget to kep your CV updated with you recent project experience on a real time basis.,Staffing,QnA
What is Abacus Tool? ,ABACUS is the tool used by project POC as well as scheduling team for end to end management of staffing processes.,Staffing,QnA
What is the difference between AG Holding place and ITP? ,AG Holding place is a reserved pool of employees who have skills that match anticipated demand in that particular Industry Group. IGs also use the AG Holding place to reserve employees with domain expertise so they can be deployed on projects within the same IG. However; when you are rolled off from AG Holding;  you will be aligned to ITP till the time you are assigned a new project. ,Staffing,QnA
What does it mean if the project that has interviewed me has informed that they will be soft locking me?,"Soft locking is a facility extended by IDC to clients to ""reserve"" employees – it implies that the project is considering your candidature for an opportunity; however; until you are 'Hard locked' to the project; you are not required to be working on the project and  you are not chargeable to the client. ",Staffing,QnA
What is the process to apply after an Employee receives the demand information from ITP / AG Holding supervisor ,You have to write a mail to the primary/secondary POC in the specified format (format is available with the ITP or AG holding supervisors/DUL); to apply for such demands. These POCs will then evaluate the candidate and hard lock you for the project if  your candidature is found suitable. ,Staffing,QnA
"What could be the reason if I am in ITP or AG Holding, but unable to access IJP? ",Employee on LOA or with  Non-schedulable status will have no access to IJP portal. If you have  returned from LoA you should reach out to your LoA Case manager to confirm if your return status is updated on the Atlast Service Tool (AST). After this; your name will start being visible for staffing. It takes 3-4 working days for data to flow from all tools and get refreshed. Incase your name still does not appear on the ITP list; then pls clarify with your ITP supervisor and ITP People Advisor.Non-Schedulable resource could reach out to respective ITP / AG Holding point of contact for clarifications.,Staffing,QnA
